{
  "schema_version": 4,
  "authority_source": "protected-trusted-checkout",
  "authority_binding": "exact-runtime-trusted-authority",
  "suppressions": [
    {
      "id": "guarded-auto-sync-pull-request-target",
      "tool": "zizmor",
      "rule": "dangerous-triggers",
      "finding_identity": "8bf86b08ea9c57fc07a8d5d6d4d23621d13d6101e5871f6e414abed947a873b2",
      "path": ".github/workflows/auto-sync-generated-surfaces.yml",
      "scope": "exact_line",
      "exploitability_rationale": "The protected-base workflow treats the PR checkout as data, rejects forks and stale heads before checkout, runs only protected deterministic scripts, constrains staged writeback paths, and is inspected by a protected invariant harness.",
      "approver_reference": "https://github.com/weijunswj/ai-agent-toolkit/issues/284",
      "introduction_commit": "0e940c2145a520b33f3c4b37a517b52e83674a4b",
      "expires": "2026-10-21",
      "trusted_invariant_id": "guarded-auto-sync-trust-boundary-v1",
      "trusted_invariant_closure_sha256": "e48294417bec4cb0c2631618e1ebe2d0c43c95a135846b7e4620a7d6956e4a05",
      "candidate_input_contract": [
        {
          "path": ".github/workflows/auto-sync-generated-surfaces.yml",
          "sha256": "6a3799c21cd5033e86275e50a54112b43f64e4273f0f9eeb2c7a6fe7c76c8b01"
        }
      ],
      "tool_version": "v1.28.0",
      "rule_version": "builtin-v1.28.0",
      "source_sha256": "6a3799c21cd5033e86275e50a54112b43f64e4273f0f9eeb2c7a6fe7c76c8b01"
    },
    {
      "id": "synthetic-private-prompt-fixture",
      "tool": "gitleaks-cli",
      "rule": "generic-api-key",
      "finding_identity": "1649391968f90bc87c9cd07697765e8be5fced9f9423c339afefe3380f9015e7",
      "path": "repo/tests/fixtures/security-gate/synthetic-private-prompt.txt",
      "scope": "synthetic_fixture",
      "exploitability_rationale": "Exact synthetic prompt fixture whose protected invariant harness verifies bounded stdin-only prompt transport against exact candidate inputs.",
      "approver_reference": "https://github.com/weijunswj/ai-agent-toolkit/issues/284",
      "introduction_commit": "4d8c6e933af903c7f39a23720806b631d51d9a6e",
      "expires": "2026-10-21",
      "trusted_invariant_id": "synthetic-private-prompt-transport-v1",
      "trusted_invariant_closure_sha256": "e48294417bec4cb0c2631618e1ebe2d0c43c95a135846b7e4620a7d6956e4a05",
      "candidate_input_contract": [
        {
          "path": "repo/tests/fixtures/security-gate/synthetic-private-prompt.txt",
          "sha256": "cb1faad6a6c8b573895c91916b202bc22a558d7534ef58e69af9ca2e59b702ff"
        },
        {
          "path": "repo/scripts/toolkit-agent-control.cjs",
          "sha256": "03c16061522afbf4e7c1459704b34e9e4a8283fc02f6c6ceddfc98b900cf50c7"
        }
      ],
      "tool_version": "v8.30.1",
      "rule_version": "builtin-v8.30.1 plus repo config",
      "source_sha256": "cb1faad6a6c8b573895c91916b202bc22a558d7534ef58e69af9ca2e59b702ff"
    }
  ]
}
